{
  "schema": "planner-routing-input-v1",
  "task_id": "D-0022-W",
  "risk_hint": "low",
  "complexity_hint": "low",
  "preferred": "codex",
  "fallback": [
    "glm"
  ],
  "fallback_policy": "normal",
  "provider_state": {
    "qwen": {
      "available": true,
      "resource_pressure": "low"
    },
    "glm": {
      "available": true,
      "quota_state": "healthy"
    },
    "codex": {
      "available": true,
      "quota_state": "healthy"
    }
  }
}
